{
  "version": "draft-0.1",
  "request_id": "88888888-8888-4888-8888-888888888888",
  "trace_id": "22222222-2222-4222-8222-222222222222",
  "proposal_id": "77777777-7777-4777-8777-777777777777",
  "revision": 1,
  "operation": "task.complete",
  "target_ref": "st1_AAAAAAAAAAAAAAAAAAAAAAAAAAAAAAAAAAAAAAAAAAA",
  "target_version": "sv1_k1_MMMMMMMMMMMMMMMMMMMMMMMMMMMMMMMMMMMMMMMMMMM",
  "content_digest": "97167581b874e2d84fe9b1c0b947c9d07aebaf9dd2546db3fa6d67e19a6fa8e3",
  "idempotency_key": "99999999-9999-4999-8999-999999999999"
}
