{
  "version": "draft-0.1",
  "request_id": "44444444-4444-4444-8444-444444444444",
  "trace_id": "22222222-2222-4222-8222-222222222222",
  "proposal_id": "33333333-3333-4333-8333-333333333333",
  "revision": 2,
  "operation": "task.postpone",
  "target_ref": "st1_AAAAAAAAAAAAAAAAAAAAAAAAAAAAAAAAAAAAAAAAAAA",
  "target_version": "sv1_k1_MMMMMMMMMMMMMMMMMMMMMMMMMMMMMMMMMMMMMMMMMMM",
  "content_digest": "da7f9279a96867259d77e87a6d2f9f5429bfa134e6c1796e99b4552e5bc0db8a",
  "idempotency_key": "55555555-5555-4555-8555-555555555555"
}
